{
  "acquisition": {
    "acquisition_duration_seconds": 0.249977,
    "acquisition_mode": "offline",
    "analyzed_commit_sha": "c9d4770a6e2b5a6db7656f6b3c0bee320c7fe71b",
    "archive_ref": null,
    "archive_source_url": null,
    "bytes_downloaded_if_available": null,
    "cache_created": false,
    "cache_hit": true,
    "cache_status": "reused",
    "cache_updated": false,
    "cached_commit_available": true,
    "checkout_timestamp": "2026-08-05T12:34:33.799936Z",
    "cleanup_duration_seconds": 0.076434,
    "cleanup_errors": [],
    "cleanup_status": "complete",
    "commit_verification_status": "verified",
    "default_branch": null,
    "fetch_method": "offline_cache",
    "fetch_performed": false,
    "fetch_timestamp": null,
    "git_commands": [
      [
        "git",
        "-c",
        "core.longpaths=true",
        "-c",
        "core.autocrlf=false",
        "-c",
        "core.eol=lf",
        "-c",
        "core.safecrlf=false",
        "--git-dir",
        "D:\\Synthetic\\Example User\\metrolith\\.archlens\\cache\\git\\r_7295c3c5327c7980422c.git",
        "rev-parse",
        "--is-bare-repository"
      ],
      [
        "git",
        "-c",
        "core.longpaths=true",
        "-c",
        "core.autocrlf=false",
        "-c",
        "core.eol=lf",
        "-c",
        "core.safecrlf=false",
        "--git-dir",
        "D:\\Synthetic\\Example User\\metrolith\\.archlens\\cache\\git\\r_7295c3c5327c7980422c.git",
        "remote",
        "get-url",
        "origin"
      ],
      [
        "git",
        "-c",
        "core.longpaths=true",
        "-c",
        "core.autocrlf=false",
        "-c",
        "core.eol=lf",
        "-c",
        "core.safecrlf=false",
        "--git-dir",
        "D:\\Synthetic\\Example User\\metrolith\\.archlens\\cache\\git\\r_7295c3c5327c7980422c.git",
        "count-objects",
        "-v"
      ],
      [
        "git",
        "-c",
        "core.longpaths=true",
        "-c",
        "core.autocrlf=false",
        "-c",
        "core.eol=lf",
        "-c",
        "core.safecrlf=false",
        "--git-dir",
        "D:\\Synthetic\\Example User\\metrolith\\.archlens\\cache\\git\\r_7295c3c5327c7980422c.git",
        "rev-parse",
        "--is-bare-repository"
      ],
      [
        "git",
        "-c",
        "core.longpaths=true",
        "-c",
        "core.autocrlf=false",
        "-c",
        "core.eol=lf",
        "-c",
        "core.safecrlf=false",
        "--git-dir",
        "D:\\Synthetic\\Example User\\metrolith\\.archlens\\cache\\git\\r_7295c3c5327c7980422c.git",
        "remote",
        "get-url",
        "origin"
      ],
      [
        "git",
        "-c",
        "core.longpaths=true",
        "-c",
        "core.autocrlf=false",
        "-c",
        "core.eol=lf",
        "-c",
        "core.safecrlf=false",
        "--git-dir",
        "D:\\Synthetic\\Example User\\metrolith\\.archlens\\cache\\git\\r_7295c3c5327c7980422c.git",
        "count-objects",
        "-v"
      ],
      [
        "git",
        "-c",
        "core.longpaths=true",
        "-c",
        "core.autocrlf=false",
        "-c",
        "core.eol=lf",
        "-c",
        "core.safecrlf=false",
        "--git-dir",
        "D:\\Synthetic\\Example User\\metrolith\\.archlens\\cache\\git\\r_7295c3c5327c7980422c.git",
        "rev-parse",
        "--verify",
        "c9d4770a6e2b5a6db7656f6b3c0bee320c7fe71b^{commit}"
      ],
      [
        "git",
        "-c",
        "core.longpaths=true",
        "-c",
        "core.autocrlf=false",
        "-c",
        "core.eol=lf",
        "-c",
        "core.safecrlf=false",
        "--git-dir",
        "D:\\Synthetic\\Example User\\metrolith\\.archlens\\cache\\git\\r_7295c3c5327c7980422c.git",
        "worktree",
        "add",
        "--detach",
        "D:\\Synthetic\\Example User\\metrolith\\.archlens\\worktrees\\archlens_checkout_vvv7mzig\\repository",
        "c9d4770a6e2b5a6db7656f6b3c0bee320c7fe71b"
      ],
      [
        "git",
        "-c",
        "core.longpaths=true",
        "-c",
        "core.autocrlf=false",
        "-c",
        "core.eol=lf",
        "-c",
        "core.safecrlf=false",
        "-C",
        "D:\\Synthetic\\Example User\\metrolith\\.archlens\\worktrees\\archlens_checkout_vvv7mzig\\repository",
        "rev-parse",
        "HEAD"
      ],
      [
        "git",
        "-c",
        "core.longpaths=true",
        "-c",
        "core.autocrlf=false",
        "-c",
        "core.eol=lf",
        "-c",
        "core.safecrlf=false",
        "-C",
        "D:\\Synthetic\\Example User\\metrolith\\.archlens\\worktrees\\archlens_checkout_vvv7mzig\\repository",
        "status",
        "--porcelain=v1",
        "--untracked-files=all"
      ],
      [
        "git",
        "-c",
        "core.longpaths=true",
        "-c",
        "core.autocrlf=false",
        "-c",
        "core.eol=lf",
        "-c",
        "core.safecrlf=false",
        "-C",
        "D:\\Synthetic\\Example User\\metrolith\\.archlens\\worktrees\\archlens_checkout_vvv7mzig\\repository",
        "read-tree",
        "HEAD"
      ],
      [
        "git",
        "-c",
        "core.longpaths=true",
        "-c",
        "core.autocrlf=false",
        "-c",
        "core.eol=lf",
        "-c",
        "core.safecrlf=false",
        "-C",
        "D:\\Synthetic\\Example User\\metrolith\\.archlens\\worktrees\\archlens_checkout_vvv7mzig\\repository",
        "update-index",
        "--refresh"
      ],
      [
        "git",
        "-c",
        "core.longpaths=true",
        "-c",
        "core.autocrlf=false",
        "-c",
        "core.eol=lf",
        "-c",
        "core.safecrlf=false",
        "-C",
        "D:\\Synthetic\\Example User\\metrolith\\.archlens\\worktrees\\archlens_checkout_vvv7mzig\\repository",
        "diff-files",
        "--name-only",
        "-z"
      ],
      [
        "git",
        "-c",
        "core.longpaths=true",
        "-c",
        "core.autocrlf=false",
        "-c",
        "core.eol=lf",
        "-c",
        "core.safecrlf=false",
        "-C",
        "D:\\Synthetic\\Example User\\metrolith\\.archlens\\worktrees\\archlens_checkout_vvv7mzig\\repository",
        "status",
        "--porcelain=v1",
        "--untracked-files=all"
      ],
      [
        "git",
        "-c",
        "core.longpaths=true",
        "-c",
        "core.autocrlf=false",
        "-c",
        "core.eol=lf",
        "-c",
        "core.safecrlf=false",
        "-C",
        "D:\\Synthetic\\Example User\\metrolith\\.archlens\\worktrees\\archlens_checkout_vvv7mzig\\repository",
        "read-tree",
        "HEAD"
      ],
      [
        "git",
        "-c",
        "core.longpaths=true",
        "-c",
        "core.autocrlf=false",
        "-c",
        "core.eol=lf",
        "-c",
        "core.safecrlf=false",
        "-C",
        "D:\\Synthetic\\Example User\\metrolith\\.archlens\\worktrees\\archlens_checkout_vvv7mzig\\repository",
        "update-index",
        "--refresh"
      ],
      [
        "git",
        "-c",
        "core.longpaths=true",
        "-c",
        "core.autocrlf=false",
        "-c",
        "core.eol=lf",
        "-c",
        "core.safecrlf=false",
        "-C",
        "D:\\Synthetic\\Example User\\metrolith\\.archlens\\worktrees\\archlens_checkout_vvv7mzig\\repository",
        "diff-files",
        "--name-only",
        "-z"
      ],
      [
        "git",
        "-c",
        "core.longpaths=true",
        "-c",
        "core.autocrlf=false",
        "-c",
        "core.eol=lf",
        "-c",
        "core.safecrlf=false",
        "--git-dir",
        "D:\\Synthetic\\Example User\\metrolith\\.archlens\\cache\\git\\r_7295c3c5327c7980422c.git",
        "worktree",
        "remove",
        "--force",
        "D:\\Synthetic\\Example User\\metrolith\\.archlens\\worktrees\\archlens_checkout_vvv7mzig\\repository"
      ],
      [
        "git",
        "-c",
        "core.longpaths=true",
        "-c",
        "core.autocrlf=false",
        "-c",
        "core.eol=lf",
        "-c",
        "core.safecrlf=false",
        "--git-dir",
        "D:\\Synthetic\\Example User\\metrolith\\.archlens\\cache\\git\\r_7295c3c5327c7980422c.git",
        "worktree",
        "prune"
      ]
    ],
    "network_contacted": false,
    "post_analysis_checkout_status": "clean",
    "remote_checked": false,
    "repository_name": "microservices",
    "repository_owner": "umermansoor",
    "repository_url": "https://github.com/umermansoor/microservices",
    "requested_commit_sha": "c9d4770a6e2b5a6db7656f6b3c0bee320c7fe71b",
    "resolved_ref": "c9d4770a6e2b5a6db7656f6b3c0bee320c7fe71b",
    "worktree_duration_seconds": 0.26414
  },
  "analysis_status": "partial",
  "architecture_type": "microservices",
  "architecture_type_source": "benchmark_input",
  "artifact_schema_version": "1.4.0",
  "audits": {},
  "audits_status": "skipped_by_execution_mode",
  "checkpoint_status": "complete",
  "classification": null,
  "classification_status": "skipped_by_execution_mode",
  "core_metric_status": "partial",
  "coverage": {},
  "coverage_analysis_status": "skipped_by_execution_mode",
  "db_analysis": {},
  "db_analysis_status": "skipped_by_execution_mode",
  "deployability": {},
  "deployability_status": "skipped_by_execution_mode",
  "distribution_name": "archlens",
  "endpoint_analysis_status": "skipped_by_execution_mode",
  "endpoints": [],
  "errors": [
    {
      "affected_metrics": [
        "classes_structs",
        "methods_functions"
      ],
      "alternating_nul_evidence": {
        "alternating": false,
        "dominant_parity_ratio": 0.0,
        "even_position_nuls": 0,
        "odd_position_nuls": 0
      },
      "analyzed_commit_sha": "c9d4770a6e2b5a6db7656f6b3c0bee320c7fe71b",
      "detected_language": "Python",
      "encoding_transformation_applied": null,
      "error_category": "unsupported_language_version",
      "error_type": "unsupported_language_version",